<?xml version="1.0"?>
<sweep runs="2" xmlns:xsi="http://www.w3.org/2001/XMLSchema-instance" xsi:noNamespaceSchemaLocation="batch_params.xsd">

  <parameter name="double_const" type="constant" constant_type="number" value="4.0"/>
  <parameter name="long_const" type="constant" constant_type="number" value="11L"/>
	<parameter name="string_const" type="constant" constant_type="string" value="hello cormac"/>
	<parameter name="boolean_const" type="constant" constant_type="boolean" value="false"/>

	<parameter name="long_param" type="number" start="1L" end="3" step="1">
		<parameter name="float_param" type="number" start=".8f" end="1.0f" step=".1f">
			<parameter name="string_param" type="list" value_type="String" values="foo bar">
				<parameter name="randomSeed" type="list" value_type="int" values="1 2"/>
				</parameter>
		</parameter>
	</parameter>
</sweep>